{"$id":"urn:mcpaudit:evidence-conservation:FreezeReceiptV1","$schema":"https://json-schema.org/draft/2020-12/schema","additionalProperties":false,"properties":{"admission_status":{"enum":["CANDIDATE","ADMITTED","REJECTED"]},"body":{"additionalProperties":false,"properties":{"all_objects_resolve":{"type":"boolean"},"artifacts":{"items":{"additionalProperties":false,"properties":{"kind":{"minLength":1,"type":"string"},"name":{"minLength":1,"type":"string"},"sha256":{"pattern":"^[0-9a-f]{64}$","type":"string"},"version":{"minLength":1,"type":"string"}},"required":["name","version","kind","sha256"],"type":"object"},"type":"array"},"clock_contract":{"minLength":1,"type":"string"},"components":{"items":{"additionalProperties":false,"properties":{"contract_ids":{"items":{"minLength":1,"type":"string"},"minItems":1,"type":"array"},"locks":{"items":{"additionalProperties":false,"properties":{"format":{"minLength":1,"type":"string"},"path":{"minLength":1,"type":"string"},"sha256":{"pattern":"^[0-9a-f]{64}$","type":"string"}},"required":["path","sha256","format"],"type":"object"},"minItems":1,"type":"array"},"manifests":{"items":{"additionalProperties":false,"properties":{"format":{"minLength":1,"type":"string"},"path":{"minLength":1,"type":"string"},"sha256":{"pattern":"^[0-9a-f]{64}$","type":"string"}},"required":["path","sha256","format"],"type":"object"},"minItems":1,"type":"array"},"repository":{"minLength":1,"type":"string"},"revision":{"pattern":"^[0-9a-f]{40}$","type":"string"},"role":{"enum":["PRODUCER","CONSUMER"]},"runtime_declarations":{"items":{"additionalProperties":false,"properties":{"constraint":{"minLength":1,"type":"string"},"path":{"minLength":1,"type":"string"},"sha256":{"pattern":"^[0-9a-f]{64}$","type":"string"}},"required":["path","sha256","constraint"],"type":"object"},"minItems":1,"type":"array"},"source_files":{"items":{"additionalProperties":false,"properties":{"path":{"minLength":1,"type":"string"},"sha256":{"pattern":"^[0-9a-f]{64}$","type":"string"}},"required":["path","sha256"],"type":"object"},"minItems":1,"type":"array"}},"required":["role","repository","revision","contract_ids","source_files","manifests","locks","runtime_declarations"],"type":"object"},"minItems":1,"type":"array"},"lock_consistency":{"additionalProperties":false,"properties":{"receipt_sha256":{"pattern":"^[0-9a-f]{64}$","type":"string"},"status":{"enum":["VERIFIED","FAILED"]},"verifier":{"minLength":1,"type":"string"}},"required":["status","verifier","receipt_sha256"],"type":"object"},"path_id":{"enum":["P1","P2","P3"]},"resolved_environment":{"additionalProperties":false,"properties":{"architecture":{"minLength":1,"type":"string"},"filesystem_semantics":{"type":"object"},"os":{"minLength":1,"type":"string"},"package_manager_versions":{"type":"object"},"runtime_versions":{"type":"object"},"sqlite_version":{"minLength":1,"type":"string"}},"required":["os","architecture","runtime_versions","package_manager_versions","sqlite_version","filesystem_semantics"],"type":"object"}},"required":["path_id","components","artifacts","resolved_environment","lock_consistency","clock_contract","all_objects_resolve"],"type":"object"},"content_sha256":{"pattern":"^[0-9a-f]{64}$","type":"string"},"created_at_utc":{"minLength":1,"type":"string"},"producer":{"additionalProperties":false,"properties":{"actor_id":{"minLength":1,"type":"string"},"role":{"minLength":1,"type":"string"}},"required":["actor_id","role"],"type":"object"},"record_id":{"minLength":1,"type":"string"},"reviews":{"items":{"additionalProperties":false,"properties":{"decision":{"enum":["ADMIT","REJECT"]},"independent_from":{"items":{"minLength":1,"type":"string"},"type":"array"},"rationale":{"minLength":1,"type":"string"},"reviewed_at_utc":{"minLength":1,"type":"string"},"reviewed_content_sha256":{"pattern":"^[0-9a-f]{64}$","type":"string"},"reviewer_id":{"minLength":1,"type":"string"}},"required":["reviewer_id","independent_from","decision","reviewed_at_utc","reviewed_content_sha256","rationale"],"type":"object"},"type":"array"},"schema":{"const":"FreezeReceiptV1"},"spec_sha256":{"pattern":"^[0-9a-f]{64}$","type":"string"},"supersedes":{"type":["string","null"]}},"required":["schema","record_id","spec_sha256","created_at_utc","producer","supersedes","body","content_sha256","reviews","admission_status"],"type":"object"}
