{"admission_status":"CANDIDATE","body":{"all_objects_resolve":true,"artifacts":[],"clock_contract":"UTC fixed clock; P1 freshness 24h; P2 exact expiry is stale","components":[{"contract_ids":["RecoveryAnchorV1","source-schema-22","BridgeRecoveryReadinessProjection"],"locks":[{"format":"UV_LOCK","path":"uv.lock","sha256":"f300fccebaa2a5e68ceb3f98ced5bb115038dd6bfc19c8f93829d64d3c8d736f"}],"manifests":[{"format":"TOML","path":"pyproject.toml","sha256":"2d2d6fd5128603e2757a6952f21c06b6eb2b7493b8669e325de964f27692a595"}],"repository":"bridge-db","revision":"b47e5428b0f512c5e4ab87212acdd1d844b365b0","role":"PRODUCER","runtime_declarations":[{"constraint":"Python 3.12 family; project >=3.12","path":".python-version","sha256":"7b55f8e67b5623c4bef3fa691288da9437d79d3aba156de48d481db32ac7d16d"}],"source_files":[{"path":"src/bridge_db/recovery.py","sha256":"4a67339663dfd4f4317c80071f1dd5d25b13f74cf49905cd766d3cf1fd22a356"},{"path":"src/bridge_db/db.py","sha256":"96ad93104be0aedf9349ccb8b7ceb25f51cfff03c2ac39e59bc7fc2f32ae76f5"},{"path":"src/bridge_db/tools/health.py","sha256":"565955fcb2b26515646420126e814edeeadbf2a88080fbd1c040bfbd3ee1660b"}]}],"lock_consistency":{"receipt_sha256":"063c1d6a8ce840541084836dab6724421f435410f9bccfb60a70297e52777c81","status":"VERIFIED","verifier":"OfflineLockConsistencyReceiptV1"},"path_id":"P3","resolved_environment":{"architecture":"arm64","filesystem_semantics":{"filesystem":"APFS","posix_private_modes":"OBSERVED_LOCAL_ONLY"},"os":"macOS 26.6; Darwin 25.6.0","package_manager_versions":{"cargo":"1.97.1","pnpm":"11.18.0","uv":"0.12.0"},"runtime_versions":{"GithubRepoAuditor":"Python 3.12.13","MCPAudit":"Python 3.11.15","Node":"26.5.0","Rust":"1.97.1","bridge-db":"Python 3.12.13","mcp-trust":"Python 3.12.13"},"sqlite_version":"3.50.4"}},"content_sha256":"b7d1b72512b5d35f423d0ec66608b2bffc3826c487df0231c7681a08a5989aa0","created_at_utc":"2026-07-31T16:20:00Z","producer":{"actor_id":"codex","role":"EVIDENCE_PACKAGE_GENERATOR"},"record_id":"freeze-receipt-p3-v1","reviews":[],"schema":"FreezeReceiptV1","spec_sha256":"711b5c32b053a0e471b9d7e8b0327160d205a8bdfa88f207a921909905afd188","supersedes":null}
