{"admission_status":"CANDIDATE","body":{"all_objects_resolve":true,"artifacts":[{"kind":"wheel","name":"mcp_audits-2.4.0-py3-none-any.whl","sha256":"5a2e18c9271d381a5d5482f7baf2bcd64cd52bdbdfd14cc501c32334b0aac66a","version":"2.4.0"},{"kind":"sdist","name":"mcp_audits-2.4.0.tar.gz","sha256":"a7dd4733d3413d15fabcd2d8aa763b2b95b237b8af99b50d507b98a716a7641d","version":"2.4.0"}],"clock_contract":"UTC fixed clock; P1 freshness 24h; P2 exact expiry is stale","components":[{"contract_ids":["mcp-audits==2.4.0","EngineResult"],"locks":[{"format":"UV_LOCK","path":"uv.lock","sha256":"b68639c0bc8746066d8da1461d27bbbd240454beb368b6cdae9300adc2e454af"}],"manifests":[{"format":"TOML","path":"pyproject.toml","sha256":"11390acdc5225dd1fcde052b3e08c56eb4ef3ddab5fd81316a48c4787ef6777b"}],"repository":"MCPAudit","revision":"9484d8bb1b059ce48f77015c4a84561675517a77","role":"PRODUCER","runtime_declarations":[{"constraint":"Python 3.11 family; project >=3.11","path":".python-version","sha256":"49a506dd32096b010d75205acf3430c9ae6c40351888129499e5a5e487126c93"}],"source_files":[{"path":"src/mcp_audit/engine.py","sha256":"60c1e125b0ef711311a8daea37a5c3aecf821be4c0d20910961feb835ede9181"},{"path":"src/mcp_audit/models.py","sha256":"356613e707e27f167f1f76cb92e0fbdd92d9383e110cd619387c28724b814a50"}]},{"contract_ids":["MCPTrustPerServerFixtureAdmissibilityV1","RefreshCandidateV1","receipt-format-1"],"locks":[{"format":"UV_LOCK","path":"uv.lock","sha256":"2bfd0d8f432abf289644b2fdca2e17b8cd30a1937dd36d57dfdb5a313a893609"}],"manifests":[{"format":"TOML","path":"pyproject.toml","sha256":"f3bac0415dbc201ddc6de73fffc207b651f8eb395674d2f9a0574c4b3e2e7c3d"}],"repository":"mcp-trust","revision":"a30be69132802d2b24157066fa4dc125e8edfdca","role":"CONSUMER","runtime_declarations":[{"constraint":"Python >=3.11; exact patch unpinned","path":"pyproject.toml","sha256":"f3bac0415dbc201ddc6de73fffc207b651f8eb395674d2f9a0574c4b3e2e7c3d"}],"source_files":[{"path":"src/mcp_trust/engine/base.py","sha256":"dc1e6b2fdebb0ae42628b16d6dd2f68c0718c377a3f95b6f0414b0248617c5c3"},{"path":"src/mcp_trust/engine/mcpaudit.py","sha256":"b717493bb4e5ded3a06c16a2064ddb794ab33a71f1b7ee8a5e4ef7747bc7093a"},{"path":"src/mcp_trust/refresh.py","sha256":"d54ed0300c99793f18019010802520392b077bd642581c2cae53460ed925cda6"}]}],"lock_consistency":{"receipt_sha256":"2db9ac21301c602da9ebd0a2ac192740752c32dc4d52759ab702a2cfc5d5198f","status":"VERIFIED","verifier":"OfflineLockConsistencyReceiptV1"},"path_id":"P2","resolved_environment":{"architecture":"arm64","filesystem_semantics":{"filesystem":"APFS","posix_private_modes":"OBSERVED_LOCAL_ONLY"},"os":"macOS 26.6; Darwin 25.6.0","package_manager_versions":{"cargo":"1.97.1","pnpm":"11.18.0","uv":"0.12.0"},"runtime_versions":{"GithubRepoAuditor":"Python 3.12.13","MCPAudit":"Python 3.11.15","Node":"26.5.0","Rust":"1.97.1","bridge-db":"Python 3.12.13","mcp-trust":"Python 3.12.13"},"sqlite_version":"3.50.4"}},"content_sha256":"65743a7218970ba4d61734d7d96bbb61b56db830f0318a79b06b1f56bc2e289c","created_at_utc":"2026-07-31T16:20:00Z","producer":{"actor_id":"codex","role":"EVIDENCE_PACKAGE_GENERATOR"},"record_id":"freeze-receipt-p2-v1","reviews":[],"schema":"FreezeReceiptV1","spec_sha256":"711b5c32b053a0e471b9d7e8b0327160d205a8bdfa88f207a921909905afd188","supersedes":null}
